### Starting TaskPrologue of job 3268970 on a0601 at Tue Jan 13 02:31:15 CET 2026
Running on cores 0-15 with governor ondemand
Tue Jan 13 02:31:15 2026       
+-----------------------------------------------------------------------------------------+
| NVIDIA-SMI 580.105.08             Driver Version: 580.105.08     CUDA Version: 13.0     |
+-----------------------------------------+------------------------+----------------------+
| GPU  Name                 Persistence-M | Bus-Id          Disp.A | Volatile Uncorr. ECC |
| Fan  Temp   Perf          Pwr:Usage/Cap |           Memory-Usage | GPU-Util  Compute M. |
|                                         |                        |               MIG M. |
|=========================================+========================+======================|
|   0  NVIDIA A100-SXM4-40GB          On  |   00000000:0E:00.0 Off |                    0 |
| N/A   36C    P0             56W /  400W |       0MiB /  40960MiB |      0%      Default |
|                                         |                        |             Disabled |
+-----------------------------------------+------------------------+----------------------+

+-----------------------------------------------------------------------------------------+
| Processes:                                                                              |
|  GPU   GI   CI              PID   Type   Process name                        GPU Memory |
|        ID   ID                                                               Usage      |
|=========================================================================================|
|  No running processes found                                                             |
+-----------------------------------------------------------------------------------------+
### Finished TaskPrologue

/var/tmp/slurmd_spool/job3268970/slurm_script: line 9: module: command not found
/var/tmp/slurmd_spool/job3268970/slurm_script: line 10: module: command not found
=== GPU CHECK ===
Tue Jan 13 02:31:16 2026       
+-----------------------------------------------------------------------------------------+
| NVIDIA-SMI 580.105.08             Driver Version: 580.105.08     CUDA Version: 13.0     |
+-----------------------------------------+------------------------+----------------------+
| GPU  Name                 Persistence-M | Bus-Id          Disp.A | Volatile Uncorr. ECC |
| Fan  Temp   Perf          Pwr:Usage/Cap |           Memory-Usage | GPU-Util  Compute M. |
|                                         |                        |               MIG M. |
|=========================================+========================+======================|
|   0  NVIDIA A100-SXM4-40GB          On  |   00000000:0E:00.0 Off |                    0 |
| N/A   36C    P0             67W /  400W |       0MiB /  40960MiB |      0%      Default |
|                                         |                        |             Disabled |
+-----------------------------------------+------------------------+----------------------+

+-----------------------------------------------------------------------------------------+
| Processes:                                                                              |
|  GPU   GI   CI              PID   Type   Process name                        GPU Memory |
|        ID   ID                                                               Usage      |
|=========================================================================================|
|  No running processes found                                                             |
+-----------------------------------------------------------------------------------------+
cuda: True
=================
Loading tokenizer...
Loading detector...
Loading weights:   0%|          | 0/138 [00:00<?, ?it/s]Loading weights:   1%|          | 1/138 [00:00<00:00, 19418.07it/s, Materializing param=classifier.bias]Loading weights:   1%|          | 1/138 [00:00<00:00, 8004.40it/s, Materializing param=classifier.bias] Loading weights:   1%|▏         | 2/138 [00:00<00:00, 421.14it/s, Materializing param=classifier.weight]Loading weights:   1%|▏         | 2/138 [00:00<00:00, 305.36it/s, Materializing param=classifier.weight]Loading weights:   2%|▏         | 3/138 [00:00<00:00, 351.89it/s, Materializing param=head.dense.weight]Loading weights:   2%|▏         | 3/138 [00:00<00:00, 349.18it/s, Materializing param=head.dense.weight]Loading weights:   3%|▎         | 4/138 [00:00<00:00, 459.61it/s, Materializing param=head.norm.weight] Loading weights:   3%|▎         | 4/138 [00:00<00:00, 456.75it/s, Materializing param=head.norm.weight]Loading weights:   4%|▎         | 5/138 [00:00<00:00, 564.59it/s, Materializing param=model.embeddings.norm.weight]Loading weights:   4%|▎         | 5/138 [00:00<00:00, 561.32it/s, Materializing param=model.embeddings.norm.weight]Loading weights:   4%|▍         | 6/138 [00:00<00:00, 665.16it/s, Materializing param=model.embeddings.tok_embeddings.weight]Loading weights:   4%|▍         | 6/138 [00:00<00:00, 661.02it/s, Materializing param=model.embeddings.tok_embeddings.weight]Loading weights:   5%|▌         | 7/138 [00:00<00:00, 758.68it/s, Materializing param=model.final_norm.weight]               Loading weights:   5%|▌         | 7/138 [00:00<00:00, 601.96it/s, Materializing param=model.final_norm.weight]Loading weights:   6%|▌         | 8/138 [00:00<00:00, 681.32it/s, Materializing param=model.layers.0.attn.Wo.weight]Loading weights:   6%|▌         | 8/138 [00:00<00:00, 678.32it/s, Materializing param=model.layers.0.attn.Wo.weight]Loading weights:   7%|▋         | 9/138 [00:00<00:00, 756.68it/s, Materializing param=model.layers.0.attn.Wqkv.weight]Loading weights:   7%|▋         | 9/138 [00:00<00:00, 753.05it/s, Materializing param=model.layers.0.attn.Wqkv.weight]Loading weights:   7%|▋         | 10/138 [00:00<00:00, 829.72it/s, Materializing param=model.layers.0.mlp.Wi.weight]  Loading weights:   7%|▋         | 10/138 [00:00<00:00, 826.30it/s, Materializing param=model.layers.0.mlp.Wi.weight]Loading weights:   8%|▊         | 11/138 [00:00<00:00, 901.67it/s, Materializing param=model.layers.0.mlp.Wo.weight]Loading weights:   8%|▊         | 11/138 [00:00<00:00, 898.03it/s, Materializing param=model.layers.0.mlp.Wo.weight]Loading weights:   9%|▊         | 12/138 [00:00<00:00, 971.95it/s, Materializing param=model.layers.0.mlp_norm.weight]Loading weights:   9%|▊         | 12/138 [00:00<00:00, 968.10it/s, Materializing param=model.layers.0.mlp_norm.weight]Loading weights:   9%|▉         | 13/138 [00:00<00:00, 1040.85it/s, Materializing param=model.layers.1.attn.Wo.weight]Loading weights:   9%|▉         | 13/138 [00:00<00:00, 1036.77it/s, Materializing param=model.layers.1.attn.Wo.weight]Loading weights:  10%|█         | 14/138 [00:00<00:00, 1107.89it/s, Materializing param=model.layers.1.attn.Wqkv.weight]Loading weights:  10%|█         | 14/138 [00:00<00:00, 1103.41it/s, Materializing param=model.layers.1.attn.Wqkv.weight]Loading weights:  11%|█         | 15/138 [00:00<00:00, 1173.32it/s, Materializing param=model.layers.1.attn_norm.weight]Loading weights:  11%|█         | 15/138 [00:00<00:00, 1168.81it/s, Materializing param=model.layers.1.attn_norm.weight]Loading weights:  12%|█▏        | 16/138 [00:00<00:00, 1236.28it/s, Materializing param=model.layers.1.mlp.Wi.weight]   Loading weights:  12%|█▏        | 16/138 [00:00<00:00, 1231.11it/s, Materializing param=model.layers.1.mlp.Wi.weight]Loading weights:  12%|█▏        | 17/138 [00:00<00:00, 1298.22it/s, Materializing param=model.layers.1.mlp.Wo.weight]Loading weights:  12%|█▏        | 17/138 [00:00<00:00, 1293.25it/s, Materializing param=model.layers.1.mlp.Wo.weight]Loading weights:  13%|█▎        | 18/138 [00:00<00:00, 1359.56it/s, Materializing param=model.layers.1.mlp_norm.weight]Loading weights:  13%|█▎        | 18/138 [00:00<00:00, 1354.60it/s, Materializing param=model.layers.1.mlp_norm.weight]Loading weights:  14%|█▍        | 19/138 [00:00<00:00, 1419.49it/s, Materializing param=model.layers.2.attn.Wo.weight] Loading weights:  14%|█▍        | 19/138 [00:00<00:00, 1403.15it/s, Materializing param=model.layers.2.attn.Wo.weight]Loading weights:  14%|█▍        | 20/138 [00:00<00:00, 1464.95it/s, Materializing param=model.layers.2.attn.Wqkv.weight]Loading weights:  14%|█▍        | 20/138 [00:00<00:00, 1459.73it/s, Materializing param=model.layers.2.attn.Wqkv.weight]Loading weights:  15%|█▌        | 21/138 [00:00<00:00, 1522.25it/s, Materializing param=model.layers.2.attn_norm.weight]Loading weights:  15%|█▌        | 21/138 [00:00<00:00, 1516.98it/s, Materializing param=model.layers.2.attn_norm.weight]Loading weights:  16%|█▌        | 22/138 [00:00<00:00, 1307.82it/s, Materializing param=model.layers.2.mlp.Wi.weight]   Loading weights:  16%|█▌        | 22/138 [00:00<00:00, 1221.66it/s, Materializing param=model.layers.2.mlp.Wi.weight]Loading weights:  17%|█▋        | 23/138 [00:00<00:00, 1268.93it/s, Materializing param=model.layers.2.mlp.Wo.weight]Loading weights:  17%|█▋        | 23/138 [00:00<00:00, 1265.30it/s, Materializing param=model.layers.2.mlp.Wo.weight]Loading weights:  17%|█▋        | 24/138 [00:00<00:00, 1308.44it/s, Materializing param=model.layers.2.mlp_norm.weight]Loading weights:  17%|█▋        | 24/138 [00:00<00:00, 1137.18it/s, Materializing param=model.layers.2.mlp_norm.weight]Loading weights:  18%|█▊        | 25/138 [00:00<00:00, 1171.96it/s, Materializing param=model.layers.3.attn.Wo.weight] Loading weights:  18%|█▊        | 25/138 [00:00<00:00, 1169.06it/s, Materializing param=model.layers.3.attn.Wo.weight]Loading weights:  19%|█▉        | 26/138 [00:00<00:00, 1173.16it/s, Materializing param=model.layers.3.attn.Wqkv.weight]Loading weights:  19%|█▉        | 26/138 [00:00<00:00, 1170.27it/s, Materializing param=model.layers.3.attn.Wqkv.weight]Loading weights:  20%|█▉        | 27/138 [00:00<00:00, 1146.38it/s, Materializing param=model.layers.3.attn_norm.weight]Loading weights:  20%|█▉        | 27/138 [00:00<00:00, 1143.64it/s, Materializing param=model.layers.3.attn_norm.weight]Loading weights:  20%|██        | 28/138 [00:00<00:00, 1180.85it/s, Materializing param=model.layers.3.mlp.Wi.weight]   Loading weights:  20%|██        | 28/138 [00:00<00:00, 1178.41it/s, Materializing param=model.layers.3.mlp.Wi.weight]Loading weights:  21%|██        | 29/138 [00:00<00:00, 1215.52it/s, Materializing param=model.layers.3.mlp.Wo.weight]Loading weights:  21%|██        | 29/138 [00:00<00:00, 1212.93it/s, Materializing param=model.layers.3.mlp.Wo.weight]Loading weights:  22%|██▏       | 30/138 [00:00<00:00, 1249.00it/s, Materializing param=model.layers.3.mlp_norm.weight]Loading weights:  22%|██▏       | 30/138 [00:00<00:00, 1246.43it/s, Materializing param=model.layers.3.mlp_norm.weight]Loading weights:  22%|██▏       | 31/138 [00:00<00:00, 1282.84it/s, Materializing param=model.layers.4.attn.Wo.weight] Loading weights:  22%|██▏       | 31/138 [00:00<00:00, 1280.31it/s, Materializing param=model.layers.4.attn.Wo.weight]Loading weights:  23%|██▎       | 32/138 [00:00<00:00, 1315.46it/s, Materializing param=model.layers.4.attn.Wqkv.weight]Loading weights:  23%|██▎       | 32/138 [00:00<00:00, 1312.68it/s, Materializing param=model.layers.4.attn.Wqkv.weight]Loading weights:  24%|██▍       | 33/138 [00:00<00:00, 1348.41it/s, Materializing param=model.layers.4.attn_norm.weight]Loading weights:  24%|██▍       | 33/138 [00:00<00:00, 1345.73it/s, Materializing param=model.layers.4.attn_norm.weight]Loading weights:  25%|██▍       | 34/138 [00:00<00:00, 1381.32it/s, Materializing param=model.layers.4.mlp.Wi.weight]   Loading weights:  25%|██▍       | 34/138 [00:00<00:00, 1378.66it/s, Materializing param=model.layers.4.mlp.Wi.weight]Loading weights:  25%|██▌       | 35/138 [00:00<00:00, 1413.62it/s, Materializing param=model.layers.4.mlp.Wo.weight]Loading weights:  25%|██▌       | 35/138 [00:00<00:00, 1410.87it/s, Materializing param=model.layers.4.mlp.Wo.weight]Loading weights:  26%|██▌       | 36/138 [00:00<00:00, 1408.21it/s, Materializing param=model.layers.4.mlp_norm.weight]Loading weights:  26%|██▌       | 36/138 [00:00<00:00, 1405.30it/s, Materializing param=model.layers.4.mlp_norm.weight]Loading weights:  27%|██▋       | 37/138 [00:00<00:00, 1438.99it/s, Materializing param=model.layers.5.attn.Wo.weight] Loading weights:  27%|██▋       | 37/138 [00:00<00:00, 1436.27it/s, Materializing param=model.layers.5.attn.Wo.weight]Loading weights:  28%|██▊       | 38/138 [00:00<00:00, 1469.83it/s, Materializing param=model.layers.5.attn.Wqkv.weight]Loading weights:  28%|██▊       | 38/138 [00:00<00:00, 1467.09it/s, Materializing param=model.layers.5.attn.Wqkv.weight]Loading weights:  28%|██▊       | 39/138 [00:00<00:00, 1499.53it/s, Materializing param=model.layers.5.attn_norm.weight]Loading weights:  28%|██▊       | 39/138 [00:00<00:00, 1496.72it/s, Materializing param=model.layers.5.attn_norm.weight]Loading weights:  29%|██▉       | 40/138 [00:00<00:00, 1529.71it/s, Materializing param=model.layers.5.mlp.Wi.weight]   Loading weights:  29%|██▉       | 40/138 [00:00<00:00, 1526.94it/s, Materializing param=model.layers.5.mlp.Wi.weight]Loading weights:  30%|██▉       | 41/138 [00:00<00:00, 1559.63it/s, Materializing param=model.layers.5.mlp.Wo.weight]Loading weights:  30%|██▉       | 41/138 [00:00<00:00, 1556.82it/s, Materializing param=model.layers.5.mlp.Wo.weight]Loading weights:  30%|███       | 42/138 [00:00<00:00, 1484.35it/s, Materializing param=model.layers.5.mlp_norm.weight]Loading weights:  30%|███       | 42/138 [00:00<00:00, 1481.48it/s, Materializing param=model.layers.5.mlp_norm.weight]Loading weights:  31%|███       | 43/138 [00:00<00:00, 1511.75it/s, Materializing param=model.layers.6.attn.Wo.weight] Loading weights:  31%|███       | 43/138 [00:00<00:00, 1509.21it/s, Materializing param=model.layers.6.attn.Wo.weight]Loading weights:  32%|███▏      | 44/138 [00:00<00:00, 1448.95it/s, Materializing param=model.layers.6.attn.Wqkv.weight]Loading weights:  32%|███▏      | 44/138 [00:00<00:00, 1446.36it/s, Materializing param=model.layers.6.attn.Wqkv.weight]Loading weights:  33%|███▎      | 45/138 [00:00<00:00, 1468.90it/s, Materializing param=model.layers.6.attn_norm.weight]Loading weights:  33%|███▎      | 45/138 [00:00<00:00, 1466.37it/s, Materializing param=model.layers.6.attn_norm.weight]Loading weights:  33%|███▎      | 46/138 [00:00<00:00, 1494.37it/s, Materializing param=model.layers.6.mlp.Wi.weight]   Loading weights:  33%|███▎      | 46/138 [00:00<00:00, 1492.05it/s, Materializing param=model.layers.6.mlp.Wi.weight]Loading weights:  34%|███▍      | 47/138 [00:00<00:00, 1519.97it/s, Materializing param=model.layers.6.mlp.Wo.weight]Loading weights:  34%|███▍      | 47/138 [00:00<00:00, 1516.62it/s, Materializing param=model.layers.6.mlp.Wo.weight]Loading weights:  35%|███▍      | 48/138 [00:00<00:00, 1543.87it/s, Materializing param=model.layers.6.mlp_norm.weight]Loading weights:  35%|███▍      | 48/138 [00:00<00:00, 1541.49it/s, Materializing param=model.layers.6.mlp_norm.weight]Loading weights:  36%|███▌      | 49/138 [00:00<00:00, 1517.23it/s, Materializing param=model.layers.7.attn.Wo.weight] Loading weights:  36%|███▌      | 49/138 [00:00<00:00, 1514.74it/s, Materializing param=model.layers.7.attn.Wo.weight]Loading weights:  36%|███▌      | 50/138 [00:00<00:00, 1540.96it/s, Materializing param=model.layers.7.attn.Wqkv.weight]Loading weights:  36%|███▌      | 50/138 [00:00<00:00, 1538.62it/s, Materializing param=model.layers.7.attn.Wqkv.weight]Loading weights:  37%|███▋      | 51/138 [00:00<00:00, 1564.87it/s, Materializing param=model.layers.7.attn_norm.weight]Loading weights:  37%|███▋      | 51/138 [00:00<00:00, 1562.55it/s, Materializing param=model.layers.7.attn_norm.weight]Loading weights:  38%|███▊      | 52/138 [00:00<00:00, 1588.40it/s, Materializing param=model.layers.7.mlp.Wi.weight]   Loading weights:  38%|███▊      | 52/138 [00:00<00:00, 1586.06it/s, Materializing param=model.layers.7.mlp.Wi.weight]Loading weights:  38%|███▊      | 53/138 [00:00<00:00, 1612.00it/s, Materializing param=model.layers.7.mlp.Wo.weight]Loading weights:  38%|███▊      | 53/138 [00:00<00:00, 1608.84it/s, Materializing param=model.layers.7.mlp.Wo.weight]Loading weights:  39%|███▉      | 54/138 [00:00<00:00, 1634.11it/s, Materializing param=model.layers.7.mlp_norm.weight]Loading weights:  39%|███▉      | 54/138 [00:00<00:00, 1631.75it/s, Materializing param=model.layers.7.mlp_norm.weight]Loading weights:  40%|███▉      | 55/138 [00:00<00:00, 1657.36it/s, Materializing param=model.layers.8.attn.Wo.weight] Loading weights:  40%|███▉      | 55/138 [00:00<00:00, 1654.97it/s, Materializing param=model.layers.8.attn.Wo.weight]Loading weights:  41%|████      | 56/138 [00:00<00:00, 1680.39it/s, Materializing param=model.layers.8.attn.Wqkv.weight]Loading weights:  41%|████      | 56/138 [00:00<00:00, 1678.05it/s, Materializing param=model.layers.8.attn.Wqkv.weight]Loading weights:  41%|████▏     | 57/138 [00:00<00:00, 1589.17it/s, Materializing param=model.layers.8.attn_norm.weight]Loading weights:  41%|████▏     | 57/138 [00:00<00:00, 1586.38it/s, Materializing param=model.layers.8.attn_norm.weight]Loading weights:  42%|████▏     | 58/138 [00:00<00:00, 1609.69it/s, Materializing param=model.layers.8.mlp.Wi.weight]   Loading weights:  42%|████▏     | 58/138 [00:00<00:00, 1607.49it/s, Materializing param=model.layers.8.mlp.Wi.weight]Loading weights:  43%|████▎     | 59/138 [00:00<00:00, 1630.82it/s, Materializing param=model.layers.8.mlp.Wo.weight]Loading weights:  43%|████▎     | 59/138 [00:00<00:00, 1628.66it/s, Materializing param=model.layers.8.mlp.Wo.weight]Loading weights:  43%|████▎     | 60/138 [00:00<00:00, 1652.01it/s, Materializing param=model.layers.8.mlp_norm.weight]Loading weights:  43%|████▎     | 60/138 [00:00<00:00, 1649.84it/s, Materializing param=model.layers.8.mlp_norm.weight]Loading weights:  44%|████▍     | 61/138 [00:00<00:00, 1672.97it/s, Materializing param=model.layers.9.attn.Wo.weight] Loading weights:  44%|████▍     | 61/138 [00:00<00:00, 1670.75it/s, Materializing param=model.layers.9.attn.Wo.weight]Loading weights:  45%|████▍     | 62/138 [00:00<00:00, 1658.84it/s, Materializing param=model.layers.9.attn.Wqkv.weight]Loading weights:  45%|████▍     | 62/138 [00:00<00:00, 1656.45it/s, Materializing param=model.layers.9.attn.Wqkv.weight]Loading weights:  46%|████▌     | 63/138 [00:00<00:00, 1678.94it/s, Materializing param=model.layers.9.attn_norm.weight]Loading weights:  46%|████▌     | 63/138 [00:00<00:00, 1676.82it/s, Materializing param=model.layers.9.attn_norm.weight]Loading weights:  46%|████▋     | 64/138 [00:00<00:00, 1614.38it/s, Materializing param=model.layers.9.mlp.Wi.weight]   Loading weights:  46%|████▋     | 64/138 [00:00<00:00, 1612.00it/s, Materializing param=model.layers.9.mlp.Wi.weight]Loading weights:  47%|████▋     | 65/138 [00:00<00:00, 1584.48it/s, Materializing param=model.layers.9.mlp.Wo.weight]Loading weights:  47%|████▋     | 65/138 [00:00<00:00, 1582.35it/s, Materializing param=model.layers.9.mlp.Wo.weight]Loading weights:  48%|████▊     | 66/138 [00:00<00:00, 1602.85it/s, Materializing param=model.layers.9.mlp_norm.weight]Loading weights:  48%|████▊     | 66/138 [00:00<00:00, 1600.97it/s, Materializing param=model.layers.9.mlp_norm.weight]Loading weights:  49%|████▊     | 67/138 [00:00<00:00, 1621.52it/s, Materializing param=model.layers.10.attn.Wo.weight]Loading weights:  49%|████▊     | 67/138 [00:00<00:00, 1619.65it/s, Materializing param=model.layers.10.attn.Wo.weight]Loading weights:  49%|████▉     | 68/138 [00:00<00:00, 1582.08it/s, Materializing param=model.layers.10.attn.Wqkv.weight]Loading weights:  49%|████▉     | 68/138 [00:00<00:00, 1580.04it/s, Materializing param=model.layers.10.attn.Wqkv.weight]Loading weights:  50%|█████     | 69/138 [00:00<00:00, 1599.57it/s, Materializing param=model.layers.10.attn_norm.weight]Loading weights:  50%|█████     | 69/138 [00:00<00:00, 1597.69it/s, Materializing param=model.layers.10.attn_norm.weight]Loading weights:  51%|█████     | 70/138 [00:00<00:00, 1617.09it/s, Materializing param=model.layers.10.mlp.Wi.weight]   Loading weights:  51%|█████     | 70/138 [00:00<00:00, 1615.28it/s, Materializing param=model.layers.10.mlp.Wi.weight]Loading weights:  51%|█████▏    | 71/138 [00:00<00:00, 1591.23it/s, Materializing param=model.layers.10.mlp.Wo.weight]Loading weights:  51%|█████▏    | 71/138 [00:00<00:00, 1589.31it/s, Materializing param=model.layers.10.mlp.Wo.weight]Loading weights:  52%|█████▏    | 72/138 [00:00<00:00, 1589.77it/s, Materializing param=model.layers.10.mlp_norm.weight]Loading weights:  52%|█████▏    | 72/138 [00:00<00:00, 1587.92it/s, Materializing param=model.layers.10.mlp_norm.weight]Loading weights:  53%|█████▎    | 73/138 [00:00<00:00, 1606.59it/s, Materializing param=model.layers.11.attn.Wo.weight] Loading weights:  53%|█████▎    | 73/138 [00:00<00:00, 1604.87it/s, Materializing param=model.layers.11.attn.Wo.weight]Loading weights:  54%|█████▎    | 74/138 [00:00<00:00, 1534.08it/s, Materializing param=model.layers.11.attn.Wqkv.weight]Loading weights:  54%|█████▎    | 74/138 [00:00<00:00, 1531.90it/s, Materializing param=model.layers.11.attn.Wqkv.weight]Loading weights:  54%|█████▍    | 75/138 [00:00<00:00, 1523.00it/s, Materializing param=model.layers.11.attn_norm.weight]Loading weights:  54%|█████▍    | 75/138 [00:00<00:00, 1468.44it/s, Materializing param=model.layers.11.attn_norm.weight]Loading weights:  55%|█████▌    | 76/138 [00:00<00:00, 1484.13it/s, Materializing param=model.layers.11.mlp.Wi.weight]   Loading weights:  55%|█████▌    | 76/138 [00:00<00:00, 1482.60it/s, Materializing param=model.layers.11.mlp.Wi.weight]Loading weights:  56%|█████▌    | 77/138 [00:00<00:00, 1482.96it/s, Materializing param=model.layers.11.mlp.Wo.weight]Loading weights:  56%|█████▌    | 77/138 [00:00<00:00, 1481.27it/s, Materializing param=model.layers.11.mlp.Wo.weight]Loading weights:  57%|█████▋    | 78/138 [00:00<00:00, 1497.00it/s, Materializing param=model.layers.11.mlp_norm.weight]Loading weights:  57%|█████▋    | 78/138 [00:00<00:00, 1495.52it/s, Materializing param=model.layers.11.mlp_norm.weight]Loading weights:  57%|█████▋    | 79/138 [00:00<00:00, 1511.84it/s, Materializing param=model.layers.12.attn.Wo.weight] Loading weights:  57%|█████▋    | 79/138 [00:00<00:00, 1510.43it/s, Materializing param=model.layers.12.attn.Wo.weight]Loading weights:  58%|█████▊    | 80/138 [00:00<00:00, 1526.75it/s, Materializing param=model.layers.12.attn.Wqkv.weight]Loading weights:  58%|█████▊    | 80/138 [00:00<00:00, 1525.33it/s, Materializing param=model.layers.12.attn.Wqkv.weight]Loading weights:  59%|█████▊    | 81/138 [00:00<00:00, 1541.68it/s, Materializing param=model.layers.12.attn_norm.weight]Loading weights:  59%|█████▊    | 81/138 [00:00<00:00, 1540.28it/s, Materializing param=model.layers.12.attn_norm.weight]Loading weights:  59%|█████▉    | 82/138 [00:00<00:00, 1556.58it/s, Materializing param=model.layers.12.mlp.Wi.weight]   Loading weights:  59%|█████▉    | 82/138 [00:00<00:00, 1555.18it/s, Materializing param=model.layers.12.mlp.Wi.weight]Loading weights:  60%|██████    | 83/138 [00:00<00:00, 1571.40it/s, Materializing param=model.layers.12.mlp.Wo.weight]Loading weights:  60%|██████    | 83/138 [00:00<00:00, 1528.88it/s, Materializing param=model.layers.12.mlp.Wo.weight]Loading weights:  61%|██████    | 84/138 [00:00<00:00, 1544.03it/s, Materializing param=model.layers.12.mlp_norm.weight]Loading weights:  61%|██████    | 84/138 [00:00<00:00, 1542.62it/s, Materializing param=model.layers.12.mlp_norm.weight]Loading weights:  62%|██████▏   | 85/138 [00:00<00:00, 1558.25it/s, Materializing param=model.layers.13.attn.Wo.weight] Loading weights:  62%|██████▏   | 85/138 [00:00<00:00, 1556.86it/s, Materializing param=model.layers.13.attn.Wo.weight]Loading weights:  62%|██████▏   | 86/138 [00:00<00:00, 1572.47it/s, Materializing param=model.layers.13.attn.Wqkv.weight]Loading weights:  62%|██████▏   | 86/138 [00:00<00:00, 1571.04it/s, Materializing param=model.layers.13.attn.Wqkv.weight]Loading weights:  63%|██████▎   | 87/138 [00:00<00:00, 1586.53it/s, Materializing param=model.layers.13.attn_norm.weight]Loading weights:  63%|██████▎   | 87/138 [00:00<00:00, 1585.15it/s, Materializing param=model.layers.13.attn_norm.weight]Loading weights:  64%|██████▍   | 88/138 [00:00<00:00, 1600.32it/s, Materializing param=model.layers.13.mlp.Wi.weight]   Loading weights:  64%|██████▍   | 88/138 [00:00<00:00, 1598.81it/s, Materializing param=model.layers.13.mlp.Wi.weight]Loading weights:  64%|██████▍   | 89/138 [00:00<00:00, 1614.21it/s, Materializing param=model.layers.13.mlp.Wo.weight]Loading weights:  64%|██████▍   | 89/138 [00:00<00:00, 1612.80it/s, Materializing param=model.layers.13.mlp.Wo.weight]Loading weights:  65%|██████▌   | 90/138 [00:00<00:00, 1628.22it/s, Materializing param=model.layers.13.mlp_norm.weight]Loading weights:  65%|██████▌   | 90/138 [00:00<00:00, 1626.79it/s, Materializing param=model.layers.13.mlp_norm.weight]Loading weights:  66%|██████▌   | 91/138 [00:00<00:00, 1642.18it/s, Materializing param=model.layers.14.attn.Wo.weight] Loading weights:  66%|██████▌   | 91/138 [00:00<00:00, 1640.78it/s, Materializing param=model.layers.14.attn.Wo.weight]Loading weights:  67%|██████▋   | 92/138 [00:00<00:00, 1620.79it/s, Materializing param=model.layers.14.attn.Wqkv.weight]Loading weights:  67%|██████▋   | 92/138 [00:00<00:00, 1618.53it/s, Materializing param=model.layers.14.attn.Wqkv.weight]Loading weights:  67%|██████▋   | 93/138 [00:00<00:00, 1629.68it/s, Materializing param=model.layers.14.attn_norm.weight]Loading weights:  67%|██████▋   | 93/138 [00:00<00:00, 1627.65it/s, Materializing param=model.layers.14.attn_norm.weight]Loading weights:  68%|██████▊   | 94/138 [00:00<00:00, 1641.52it/s, Materializing param=model.layers.14.mlp.Wi.weight]   Loading weights:  68%|██████▊   | 94/138 [00:00<00:00, 1622.88it/s, Materializing param=model.layers.14.mlp.Wi.weight]Loading weights:  69%|██████▉   | 95/138 [00:00<00:00, 1634.58it/s, Materializing param=model.layers.14.mlp.Wo.weight]Loading weights:  69%|██████▉   | 95/138 [00:00<00:00, 1616.90it/s, Materializing param=model.layers.14.mlp.Wo.weight]Loading weights:  70%|██████▉   | 96/138 [00:00<00:00, 1630.81it/s, Materializing param=model.layers.14.mlp_norm.weight]Loading weights:  70%|██████▉   | 96/138 [00:00<00:00, 1629.37it/s, Materializing param=model.layers.14.mlp_norm.weight]Loading weights:  70%|███████   | 97/138 [00:00<00:00, 1643.15it/s, Materializing param=model.layers.15.attn.Wo.weight] Loading weights:  70%|███████   | 97/138 [00:00<00:00, 1641.74it/s, Materializing param=model.layers.15.attn.Wo.weight]Loading weights:  71%|███████   | 98/138 [00:00<00:00, 1655.88it/s, Materializing param=model.layers.15.attn.Wqkv.weight]Loading weights:  71%|███████   | 98/138 [00:00<00:00, 1654.49it/s, Materializing param=model.layers.15.attn.Wqkv.weight]Loading weights:  72%|███████▏  | 99/138 [00:00<00:00, 1594.39it/s, Materializing param=model.layers.15.attn_norm.weight]Loading weights:  72%|███████▏  | 99/138 [00:00<00:00, 1592.86it/s, Materializing param=model.layers.15.attn_norm.weight]Loading weights:  72%|███████▏  | 100/138 [00:00<00:00, 1606.27it/s, Materializing param=model.layers.15.mlp.Wi.weight]  Loading weights:  72%|███████▏  | 100/138 [00:00<00:00, 1604.96it/s, Materializing param=model.layers.15.mlp.Wi.weight]Loading weights:  73%|███████▎  | 101/138 [00:00<00:00, 1618.49it/s, Materializing param=model.layers.15.mlp.Wo.weight]Loading weights:  73%|███████▎  | 101/138 [00:00<00:00, 1617.22it/s, Materializing param=model.layers.15.mlp.Wo.weight]Loading weights:  74%|███████▍  | 102/138 [00:00<00:00, 1629.65it/s, Materializing param=model.layers.15.mlp_norm.weight]Loading weights:  74%|███████▍  | 102/138 [00:00<00:00, 1626.35it/s, Materializing param=model.layers.15.mlp_norm.weight]Loading weights:  75%|███████▍  | 103/138 [00:00<00:00, 1623.40it/s, Materializing param=model.layers.16.attn.Wo.weight] Loading weights:  75%|███████▍  | 103/138 [00:00<00:00, 1622.06it/s, Materializing param=model.layers.16.attn.Wo.weight]Loading weights:  75%|███████▌  | 104/138 [00:00<00:00, 1587.19it/s, Materializing param=model.layers.16.attn.Wqkv.weight]Loading weights:  75%|███████▌  | 104/138 [00:00<00:00, 1585.81it/s, Materializing param=model.layers.16.attn.Wqkv.weight]Loading weights:  76%|███████▌  | 105/138 [00:00<00:00, 1598.66it/s, Materializing param=model.layers.16.attn_norm.weight]Loading weights:  76%|███████▌  | 105/138 [00:00<00:00, 1597.45it/s, Materializing param=model.layers.16.attn_norm.weight]Loading weights:  77%|███████▋  | 106/138 [00:00<00:00, 1610.37it/s, Materializing param=model.layers.16.mlp.Wi.weight]   Loading weights:  77%|███████▋  | 106/138 [00:00<00:00, 1609.21it/s, Materializing param=model.layers.16.mlp.Wi.weight]Loading weights:  78%|███████▊  | 107/138 [00:00<00:00, 1590.07it/s, Materializing param=model.layers.16.mlp.Wo.weight]Loading weights:  78%|███████▊  | 107/138 [00:00<00:00, 1588.73it/s, Materializing param=model.layers.16.mlp.Wo.weight]Loading weights:  78%|███████▊  | 108/138 [00:00<00:00, 1601.28it/s, Materializing param=model.layers.16.mlp_norm.weight]Loading weights:  78%|███████▊  | 108/138 [00:00<00:00, 1600.12it/s, Materializing param=model.layers.16.mlp_norm.weight]Loading weights:  79%|███████▉  | 109/138 [00:00<00:00, 1565.92it/s, Materializing param=model.layers.17.attn.Wo.weight] Loading weights:  79%|███████▉  | 109/138 [00:00<00:00, 1564.71it/s, Materializing param=model.layers.17.attn.Wo.weight]Loading weights:  80%|███████▉  | 110/138 [00:00<00:00, 1576.81it/s, Materializing param=model.layers.17.attn.Wqkv.weight]Loading weights:  80%|███████▉  | 110/138 [00:00<00:00, 1575.69it/s, Materializing param=model.layers.17.attn.Wqkv.weight]Loading weights:  80%|████████  | 111/138 [00:00<00:00, 1587.78it/s, Materializing param=model.layers.17.attn_norm.weight]Loading weights:  80%|████████  | 111/138 [00:00<00:00, 1586.20it/s, Materializing param=model.layers.17.attn_norm.weight]Loading weights:  81%|████████  | 112/138 [00:00<00:00, 1598.17it/s, Materializing param=model.layers.17.mlp.Wi.weight]   Loading weights:  81%|████████  | 112/138 [00:00<00:00, 1597.06it/s, Materializing param=model.layers.17.mlp.Wi.weight]Loading weights:  82%|████████▏ | 113/138 [00:00<00:00, 1609.16it/s, Materializing param=model.layers.17.mlp.Wo.weight]Loading weights:  82%|████████▏ | 113/138 [00:00<00:00, 1605.24it/s, Materializing param=model.layers.17.mlp.Wo.weight]Loading weights:  83%|████████▎ | 114/138 [00:00<00:00, 1616.96it/s, Materializing param=model.layers.17.mlp_norm.weight]Loading weights:  83%|████████▎ | 114/138 [00:00<00:00, 1615.83it/s, Materializing param=model.layers.17.mlp_norm.weight]Loading weights:  83%|████████▎ | 115/138 [00:00<00:00, 1568.28it/s, Materializing param=model.layers.18.attn.Wo.weight] Loading weights:  83%|████████▎ | 115/138 [00:00<00:00, 1567.11it/s, Materializing param=model.layers.18.attn.Wo.weight]Loading weights:  84%|████████▍ | 116/138 [00:00<00:00, 1578.60it/s, Materializing param=model.layers.18.attn.Wqkv.weight]Loading weights:  84%|████████▍ | 116/138 [00:00<00:00, 1577.56it/s, Materializing param=model.layers.18.attn.Wqkv.weight]Loading weights:  85%|████████▍ | 117/138 [00:00<00:00, 1589.09it/s, Materializing param=model.layers.18.attn_norm.weight]Loading weights:  85%|████████▍ | 117/138 [00:00<00:00, 1588.03it/s, Materializing param=model.layers.18.attn_norm.weight]Loading weights:  86%|████████▌ | 118/138 [00:00<00:00, 1599.62it/s, Materializing param=model.layers.18.mlp.Wi.weight]   Loading weights:  86%|████████▌ | 118/138 [00:00<00:00, 1598.58it/s, Materializing param=model.layers.18.mlp.Wi.weight]Loading weights:  86%|████████▌ | 119/138 [00:00<00:00, 1582.82it/s, Materializing param=model.layers.18.mlp.Wo.weight]Loading weights:  86%|████████▌ | 119/138 [00:00<00:00, 1581.70it/s, Materializing param=model.layers.18.mlp.Wo.weight]Loading weights:  87%|████████▋ | 120/138 [00:00<00:00, 1592.93it/s, Materializing param=model.layers.18.mlp_norm.weight]Loading weights:  87%|████████▋ | 120/138 [00:00<00:00, 1591.91it/s, Materializing param=model.layers.18.mlp_norm.weight]Loading weights:  88%|████████▊ | 121/138 [00:00<00:00, 1602.78it/s, Materializing param=model.layers.19.attn.Wo.weight] Loading weights:  88%|████████▊ | 121/138 [00:00<00:00, 1601.70it/s, Materializing param=model.layers.19.attn.Wo.weight]Loading weights:  88%|████████▊ | 122/138 [00:00<00:00, 1612.85it/s, Materializing param=model.layers.19.attn.Wqkv.weight]Loading weights:  88%|████████▊ | 122/138 [00:00<00:00, 1611.80it/s, Materializing param=model.layers.19.attn.Wqkv.weight]Loading weights:  89%|████████▉ | 123/138 [00:00<00:00, 1620.98it/s, Materializing param=model.layers.19.attn_norm.weight]Loading weights:  89%|████████▉ | 123/138 [00:00<00:00, 1619.73it/s, Materializing param=model.layers.19.attn_norm.weight]Loading weights:  90%|████████▉ | 124/138 [00:00<00:00, 1630.67it/s, Materializing param=model.layers.19.mlp.Wi.weight]   Loading weights:  90%|████████▉ | 124/138 [00:00<00:00, 1629.56it/s, Materializing param=model.layers.19.mlp.Wi.weight]Loading weights:  91%|█████████ | 125/138 [00:00<00:00, 1640.49it/s, Materializing param=model.layers.19.mlp.Wo.weight]Loading weights:  91%|█████████ | 125/138 [00:00<00:00, 1639.45it/s, Materializing param=model.layers.19.mlp.Wo.weight]Loading weights:  91%|█████████▏| 126/138 [00:00<00:00, 1638.36it/s, Materializing param=model.layers.19.mlp_norm.weight]Loading weights:  91%|█████████▏| 126/138 [00:00<00:00, 1637.05it/s, Materializing param=model.layers.19.mlp_norm.weight]Loading weights:  92%|█████████▏| 127/138 [00:00<00:00, 1647.96it/s, Materializing param=model.layers.20.attn.Wo.weight] Loading weights:  92%|█████████▏| 127/138 [00:00<00:00, 1646.93it/s, Materializing param=model.layers.20.attn.Wo.weight]Loading weights:  93%|█████████▎| 128/138 [00:00<00:00, 1655.61it/s, Materializing param=model.layers.20.attn.Wqkv.weight]Loading weights:  93%|█████████▎| 128/138 [00:00<00:00, 1653.13it/s, Materializing param=model.layers.20.attn.Wqkv.weight]Loading weights:  93%|█████████▎| 129/138 [00:00<00:00, 1663.83it/s, Materializing param=model.layers.20.attn_norm.weight]Loading weights:  93%|█████████▎| 129/138 [00:00<00:00, 1662.77it/s, Materializing param=model.layers.20.attn_norm.weight]Loading weights:  94%|█████████▍| 130/138 [00:00<00:00, 1673.74it/s, Materializing param=model.layers.20.mlp.Wi.weight]   Loading weights:  94%|█████████▍| 130/138 [00:00<00:00, 1672.70it/s, Materializing param=model.layers.20.mlp.Wi.weight]Loading weights:  95%|█████████▍| 131/138 [00:00<00:00, 1683.58it/s, Materializing param=model.layers.20.mlp.Wo.weight]Loading weights:  95%|█████████▍| 131/138 [00:00<00:00, 1682.51it/s, Materializing param=model.layers.20.mlp.Wo.weight]Loading weights:  96%|█████████▌| 132/138 [00:00<00:00, 1693.15it/s, Materializing param=model.layers.20.mlp_norm.weight]Loading weights:  96%|█████████▌| 132/138 [00:00<00:00, 1692.01it/s, Materializing param=model.layers.20.mlp_norm.weight]Loading weights:  96%|█████████▋| 133/138 [00:00<00:00, 1702.81it/s, Materializing param=model.layers.21.attn.Wo.weight] Loading weights:  96%|█████████▋| 133/138 [00:00<00:00, 1701.73it/s, Materializing param=model.layers.21.attn.Wo.weight]Loading weights:  97%|█████████▋| 134/138 [00:00<00:00, 1712.48it/s, Materializing param=model.layers.21.attn.Wqkv.weight]Loading weights:  97%|█████████▋| 134/138 [00:00<00:00, 1711.40it/s, Materializing param=model.layers.21.attn.Wqkv.weight]Loading weights:  98%|█████████▊| 135/138 [00:00<00:00, 1720.94it/s, Materializing param=model.layers.21.attn_norm.weight]Loading weights:  98%|█████████▊| 135/138 [00:00<00:00, 1719.81it/s, Materializing param=model.layers.21.attn_norm.weight]Loading weights:  99%|█████████▊| 136/138 [00:00<00:00, 1730.69it/s, Materializing param=model.layers.21.mlp.Wi.weight]   Loading weights:  99%|█████████▊| 136/138 [00:00<00:00, 1729.67it/s, Materializing param=model.layers.21.mlp.Wi.weight]Loading weights:  99%|█████████▉| 137/138 [00:00<00:00, 1740.54it/s, Materializing param=model.layers.21.mlp.Wo.weight]Loading weights:  99%|█████████▉| 137/138 [00:00<00:00, 1739.55it/s, Materializing param=model.layers.21.mlp.Wo.weight]Loading weights: 100%|██████████| 138/138 [00:00<00:00, 1750.42it/s, Materializing param=model.layers.21.mlp_norm.weight]Loading weights: 100%|██████████| 138/138 [00:00<00:00, 1749.41it/s, Materializing param=model.layers.21.mlp_norm.weight]Loading weights: 100%|██████████| 138/138 [00:00<00:00, 1746.88it/s, Materializing param=model.layers.21.mlp_norm.weight]
Using the latest cached version of the dataset since wikitext couldn't be found on the Hugging Face Hub (offline mode is enabled).
Loading WikiText-2 dataset...
[2026-01-13 02:31:45,152][datasets.load][WARNING] - Using the latest cached version of the dataset since wikitext couldn't be found on the Hugging Face Hub (offline mode is enabled).
Found the latest cached dataset configuration 'wikitext-2-raw-v1' at /home/janus/b116ba/b117ba41/.cache/huggingface/datasets/wikitext/wikitext-2-raw-v1/0.0.0/b08601e04326c79dfdd32d625aee71d232d685c3 (last modified on Tue Jan 13 02:24:03 2026).
[2026-01-13 02:31:45,154][datasets.packaged_modules.cache.cache][WARNING] - Found the latest cached dataset configuration 'wikitext-2-raw-v1' at /home/janus/b116ba/b117ba41/.cache/huggingface/datasets/wikitext/wikitext-2-raw-v1/0.0.0/b08601e04326c79dfdd32d625aee71d232d685c3 (last modified on Tue Jan 13 02:24:03 2026).
Processing and tokenizing dataset...
Running tokenizer on dataset (num_proc=4): 100%|██████████| 23767/23767 [00:00<?, ? examples/s]Running tokenizer on dataset (num_proc=4): 24767 examples [00:00, 1387.64 examples/s]          Running tokenizer on dataset (num_proc=4): 25767 examples [00:00, 2572.52 examples/s]Running tokenizer on dataset (num_proc=4): 26767 examples [00:01, 3515.60 examples/s]Running tokenizer on dataset (num_proc=4): 27767 examples [00:01, 4059.39 examples/s]Running tokenizer on dataset (num_proc=4): 29767 examples [00:01, 6462.36 examples/s]Running tokenizer on dataset (num_proc=4): 31767 examples [00:01, 7704.53 examples/s]Running tokenizer on dataset (num_proc=4): 34767 examples [00:01, 11058.23 examples/s]Running tokenizer on dataset (num_proc=4): 37709 examples [00:01, 12072.05 examples/s]Running tokenizer on dataset (num_proc=4): 40709 examples [00:02, 13342.29 examples/s]Running tokenizer on dataset (num_proc=4): 42651 examples [00:02, 12245.53 examples/s]Running tokenizer on dataset (num_proc=4): 44593 examples [00:02, 11784.06 examples/s]Running tokenizer on dataset (num_proc=4): 46593 examples [00:02, 11117.68 examples/s]Running tokenizer on dataset (num_proc=4): 47534 examples [00:02, 7969.73 examples/s] 
Grouping texts in chunks of 511 (num_proc=4): 100%|██████████| 23767/23767 [00:00<?, ? examples/s]Grouping texts in chunks of 511 (num_proc=4): 24767 examples [00:00, 7052.72 examples/s]          Grouping texts in chunks of 511 (num_proc=4): 32767 examples [00:00, 34943.63 examples/s]Grouping texts in chunks of 511 (num_proc=4): 40767 examples [00:00, 46384.96 examples/s]Grouping texts in chunks of 511 (num_proc=4): 47534 examples [00:00, 38353.46 examples/s]
Map (num_proc=4): 100%|██████████| 4669/4669 [00:00<?, ? examples/s]Map (num_proc=4): 5669 examples [00:00, 3283.62 examples/s]         Map (num_proc=4): 9338 examples [00:00, 9770.55 examples/s]
Processing and tokenizing dataset...
Running tokenizer on dataset (num_proc=4): 100%|██████████| 2461/2461 [00:00<?, ? examples/s]Running tokenizer on dataset (num_proc=4): 3077 examples [00:00, 997.68 examples/s]          Running tokenizer on dataset (num_proc=4): 3692 examples [00:00, 1326.99 examples/s]Running tokenizer on dataset (num_proc=4): 4307 examples [00:01, 1502.79 examples/s]Running tokenizer on dataset (num_proc=4): 4922 examples [00:01, 1637.84 examples/s]Running tokenizer on dataset (num_proc=4): 4922 examples [00:01, 1411.04 examples/s]
Grouping texts in chunks of 511 (num_proc=4): 100%|██████████| 2461/2461 [00:00<?, ? examples/s]Grouping texts in chunks of 511 (num_proc=4): 3077 examples [00:00, 5604.33 examples/s]         Grouping texts in chunks of 511 (num_proc=4): 4922 examples [00:00, 11140.34 examples/s]
Map (num_proc=4): 100%|██████████| 482/482 [00:00<?, ? examples/s]Map (num_proc=4): 603 examples [00:00, 1184.18 examples/s]        Map (num_proc=4): 964 examples [00:00, 2353.53 examples/s]
Processing and tokenizing dataset...
Running tokenizer on dataset (num_proc=4): 100%|██████████| 2891/2891 [00:00<?, ? examples/s]Running tokenizer on dataset (num_proc=4): 3614 examples [00:00, 817.08 examples/s]          Running tokenizer on dataset (num_proc=4): 4337 examples [00:01, 1292.22 examples/s]Running tokenizer on dataset (num_proc=4): 5060 examples [00:01, 1543.42 examples/s]Running tokenizer on dataset (num_proc=4): 5782 examples [00:01, 1791.59 examples/s]Running tokenizer on dataset (num_proc=4): 5782 examples [00:01, 1451.64 examples/s]
Grouping texts in chunks of 511 (num_proc=4): 100%|██████████| 2891/2891 [00:00<?, ? examples/s]Grouping texts in chunks of 511 (num_proc=4): 3613 examples [00:00, 6045.45 examples/s]         Grouping texts in chunks of 511 (num_proc=4): 5782 examples [00:00, 12563.08 examples/s]
Map (num_proc=4): 100%|██████████| 553/553 [00:00<?, ? examples/s]Map (num_proc=4): 692 examples [00:00, 1279.04 examples/s]        Map (num_proc=4): 1106 examples [00:00, 2527.50 examples/s]
Classifying dataset...
Classifying texts:   0%|          | 0/4669 [00:00<?, ? examples/s]/home/janus/b116ba/b117ba41/venvs/model_collapse/lib/python3.12/site-packages/torch/_inductor/compile_fx.py:312: UserWarning: TensorFloat32 tensor cores for float32 matrix multiplication available but not enabled. Consider setting `torch.set_float32_matmul_precision('high')` for better performance.
  warnings.warn(
Classifying texts:  21%|██▏       | 1000/4669 [00:13<00:48, 74.99 examples/s]Classifying texts:  43%|████▎     | 2000/4669 [00:17<00:21, 125.23 examples/s]Classifying texts:  64%|██████▍   | 3000/4669 [00:21<00:10, 159.42 examples/s]Classifying texts:  86%|████████▌ | 4000/4669 [00:26<00:03, 182.99 examples/s]Classifying texts: 100%|██████████| 4669/4669 [00:28<00:00, 195.05 examples/s]Classifying texts: 100%|██████████| 4669/4669 [00:28<00:00, 161.43 examples/s]
Saving classified dataset to ./data/wikitext2/train.json...
Saving classified dataset to ./data/wikitext2/validation.json...
Saving classified dataset to ./data/wikitext2/test.json...
Dataset preparation completed successfully!
Cleaning up...
Exception ignored in: <function ResourceTracker.__del__ at 0x14d29b8b6ac0>
Traceback (most recent call last):
  File "/home/janus/b116ba/b117ba41/venvs/model_collapse/lib/python3.12/site-packages/multiprocess/resource_tracker.py", line 80, in __del__
  File "/home/janus/b116ba/b117ba41/venvs/model_collapse/lib/python3.12/site-packages/multiprocess/resource_tracker.py", line 89, in _stop
  File "/home/janus/b116ba/b117ba41/venvs/model_collapse/lib/python3.12/site-packages/multiprocess/resource_tracker.py", line 102, in _stop_locked
AttributeError: '_thread.RLock' object has no attribute '_recursion_count'
/var/tmp/slurmd_spool/job3268970/slurm_script: line 28: EOF: command not found
=== JOB_STATISTICS ===
=== current date     : Tue Jan 13 02:32:33 CET 2026
= Job-ID             : 3268970 on alex
= Job-Name           : mc_prep
= Job-Command        : /home/janus/b116ba/b117ba41/projects/model_collapse/prep_data_gpu.sbatch
= Initial workdir    : /home/janus/b116ba/b117ba41/projects/model_collapse
= Partition (Res)    : a100 (hsc-a100_40)
= Slurm account      : b116ba with QOS=normal
= Features           : a100_40
= Requested resources:  for 04:00:00
= Elapsed runtime    : 00:01:18
= Total RAM usage    : 4.3 GiB of assigned  GiB (%)
= Node list          : a0601
= Subm/Elig/Start/End: 2026-01-13T02:31:14 / 2026-01-13T02:31:14 / 2026-01-13T02:31:15 / 2026-01-13T02:32:33
======================
=== Quota infos ======
    Path                 Used     SoftQ    HardQ    Gracetime  Filec    FileQ    FiHaQ    FileGrace    
    /home/hpc              99.1G   104.9G   209.7G        N/A      64K     500K   1,000K        N/A    
    /home/vault             0.0K  1048.6G  2097.2G        N/A       4      200K     400K        N/A    
    /lustre                 4.0K     0.0K     0.0K        N/A       1       80K     250K        N/A    
======================
=== GPU utilization ==
gpu_name, gpu_bus_id, pid, gpu_utilization [%], mem_utilization [%], max_memory_usage [MiB], time [ms]
NVIDIA A100-SXM4-40GB, 00000000:0E:00.0, 43689, 35 %, 7 %, 9430 MiB, 51173 ms
